~ # btmon -STA                                                                                                                                                                                                             root@CNJ1KSN01C
Bluetooth monitor ver 5.47
= Note: Linux version 4.14.76-armada-18.12.3-ga4fd10602e22 (armv7l)                                                                                                                                             2019-12-02 22:38:17.056664
= Note: Bluetooth subsystem version 2.22                                                                                                                                                                        2019-12-02 22:38:17.056668
= New Index: 20:4C:03:81:02:7D (Primary,USB,hci0)                                                                                                                                                        [hci0] 2019-12-02 22:38:17.056669
= Open Index: 20:4C:03:81:02:7D                                                                                                                                                                          [hci0] 2019-12-02 22:38:17.056670
= Index Info: 20:4C:03:81:02:7D (Marvell Technology Group Ltd.)                                                                                                                                          [hci0] 2019-12-02 22:38:17.056671
@ MGMT Open: bluetoothd (privileged) version 1.14                                                                                                                                                      {0x0002} 2019-12-02 22:38:17.056673
@ MGMT Open: bluetoothd (privileged) version 1.14                                                                                                                                                      {0x0001} 2019-12-02 22:38:17.056674
@ MGMT Open: btmon (privileged) version 1.14                                                                                                                                                           {0x0003} 2019-12-02 22:38:17.056700
> HCI Event: LE Meta Event (0x3e) plen 19                                                                                                                                                             #1 [hci0] 2019-12-02 22:38:45.447028
      LE Connection Complete (0x01)
        Status: Success (0x00)
        Handle: 128
        Role: Slave (0x01)
        Peer address type: Random (0x01)
        Peer address: 77:16:CC:2C:E3:E8 (Resolvable)
        Connection interval: 30.00 msec (0x0018)
        Connection latency: 0 (0x0000)
        Supervision timeout: 720 msec (0x0048)
        Master clock accuracy: 0x01
@ MGMT Event: Device Connected (0x000b) plen 13                                                                                                                                                 {0x0003} [hci0] 2019-12-02 22:38:45.447067
        LE Address: 77:16:CC:2C:E3:E8 (Resolvable)
        Flags: 0x00000000
        Data length: 0
@ MGMT Event: Device Connected (0x000b) plen 13                                                                                                                                                 {0x0002} [hci0] 2019-12-02 22:38:45.447067
        LE Address: 77:16:CC:2C:E3:E8 (Resolvable)
        Flags: 0x00000000
        Data length: 0
@ MGMT Event: Device Connected (0x000b) plen 13                                                                                                                                                 {0x0001} [hci0] 2019-12-02 22:38:45.447067
        LE Address: 77:16:CC:2C:E3:E8 (Resolvable)
        Flags: 0x00000000
        Data length: 0
< HCI Command: LE Read Remote Used Features (0x08|0x0016) plen 2                                                                                                                                      #2 [hci0] 2019-12-02 22:38:45.447201
        Handle: 128
> HCI Event: Command Status (0x0f) plen 4                                                                                                                                                             #3 [hci0] 2019-12-02 22:38:45.449778
      LE Read Remote Used Features (0x08|0x0016) ncmd 1
        Status: Success (0x00)
> HCI Event: LE Meta Event (0x3e) plen 11                                                                                                                                                             #4 [hci0] 2019-12-02 22:38:45.520474
      LE Data Length Change (0x07)
        Handle: 128
        Max TX octets: 251
        Max TX time: 2120
        Max RX octets: 251
        Max RX time: 2120
> HCI Event: LE Meta Event (0x3e) plen 12                                                                                                                                                             #5 [hci0] 2019-12-02 22:38:45.549751
      LE Read Remote Used Features (0x04)
        Status: Success (0x00)
        Handle: 128
        Features: 0x6f 0x01 0x00 0x00 0x00 0x00 0x00 0x00
          LE Encryption
          Connection Parameter Request Procedure
          Extended Reject Indication
          Slave-initiated Features Exchange
          LE Data Packet Length Extension
          LL Privacy
          LE 2M PHY
= bluetoothd: No cache for 77:16:CC:2C:E3:E8                                                                                                                                                                    2019-12-02 22:38:45.557776
< ACL Data TX: Handle 128 flags 0x00 dlen 7                                                                                                                                                           #6 [hci0] 2019-12-02 22:38:45.557854
      ATT: Exchange MTU Request (0x02) len 2
        Client RX MTU: 517
> HCI Event: Number of Completed Packets (0x13) plen 5                                                                                                                                                #7 [hci0] 2019-12-02 22:38:45.639849
        Num handles: 1
        Handle: 128
        Count: 1
> ACL Data RX: Handle 128 flags 0x02 dlen 7                                                                                                                                                           #8 [hci0] 2019-12-02 22:38:45.669996
      ATT: Exchange MTU Response (0x03) len 2
        Server RX MTU: 517
< ACL Data TX: Handle 128 flags 0x00 dlen 11                                                                                                                                                          #9 [hci0] 2019-12-02 22:38:45.670139
      ATT: Read By Group Type Request (0x10) len 6
        Handle range: 0x0001-0xffff
        Attribute group type: Primary Service (0x2800)
> HCI Event: Number of Completed Packets (0x13) plen 5                                                                                                                                               #10 [hci0] 2019-12-02 22:38:45.700273
        Num handles: 1
        Handle: 128
        Count: 1
> ACL Data RX: Handle 128 flags 0x02 dlen 18                                                                                                                                                         #11 [hci0] 2019-12-02 22:38:45.729680
      ATT: Read By Group Type Response (0x11) len 13
        Attribute data length: 6
        Attribute group list: 2 entries
        Handle range: 0x0001-0x0005
        UUID: Generic Access Profile (0x1800)
        Handle range: 0x0006-0x0009
        UUID: Generic Attribute Profile (0x1801)
< ACL Data TX: Handle 128 flags 0x00 dlen 11                                                                                                                                                         #12 [hci0] 2019-12-02 22:38:45.729752
      ATT: Read By Group Type Request (0x10) len 6
        Handle range: 0x000a-0xffff
        Attribute group type: Primary Service (0x2800)
> ACL Data RX: Handle 128 flags 0x02 dlen 46                                                                                                                                                         #13 [hci0] 2019-12-02 22:38:45.880078
      ATT: Read By Group Type Response (0x11) len 41
        Attribute data length: 20
        Attribute group list: 2 entries
        Handle range: 0x000a-0x000e
        UUID: Vendor specific (d0611e78-bbb4-4591-a5f8-487910ae4366)
        Handle range: 0x000f-0x0013
        UUID: Vendor specific (9fa480e0-4967-4542-9390-d343dc5d04ae)
< ACL Data TX: Handle 128 flags 0x00 dlen 11                                                                                                                                                         #14 [hci0] 2019-12-02 22:38:45.880152
      ATT: Read By Group Type Request (0x10) len 6
        Handle range: 0x0014-0xffff
        Attribute group type: Primary Service (0x2800)
> HCI Event: Number of Completed Packets (0x13) plen 5                                                                                                                                               #15 [hci0] 2019-12-02 22:38:45.880829
        Num handles: 1
        Handle: 128
        Count: 1
> ACL Data RX: Handle 128 flags 0x02 dlen 24                                                                                                                                                         #16 [hci0] 2019-12-02 22:38:45.940013
      ATT: Read By Group Type Response (0x11) len 19
        Attribute data length: 6
        Attribute group list: 3 entries
        Handle range: 0x0014-0x0017
        UUID: Battery Service (0x180f)
        Handle range: 0x0018-0x001d
        UUID: Current Time Service (0x1805)
        Handle range: 0x001e-0x0022
        UUID: Device Information (0x180a)
< ACL Data TX: Handle 128 flags 0x00 dlen 11                                                                                                                                                         #17 [hci0] 2019-12-02 22:38:45.940099
      ATT: Read By Group Type Request (0x10) len 6
        Handle range: 0x0023-0xffff
        Attribute group type: Primary Service (0x2800)
> HCI Event: Number of Completed Packets (0x13) plen 5                                                                                                                                               #18 [hci0] 2019-12-02 22:38:45.940267
        Num handles: 1
        Handle: 128
        Count: 1
> HCI Event: LE Meta Event (0x3e) plen 6                                                                                                                                                             #19 [hci0] 2019-12-02 22:38:45.967165
      LE PHY Update Complete (0x0c)
        Status: Success (0x00)
        Handle: 128
        TX PHY: LE 2M (0x02)
        RX PHY: LE 2M (0x02)
> ACL Data RX: Handle 128 flags 0x02 dlen 11                                                                                                                                                         #20 [hci0] 2019-12-02 22:38:46.180010
      ATT: Read By Group Type Request (0x10) len 6
        Handle range: 0x0001-0xffff
        Attribute group type: Primary Service (0x2800)
< ACL Data TX: Handle 128 flags 0x00 dlen 18                                                                                                                                                         #21 [hci0] 2019-12-02 22:38:46.180155
      ATT: Read By Group Type Response (0x11) len 13
        Attribute data length: 6
        Attribute group list: 2 entries
        Handle range: 0x0001-0x0005
        UUID: Generic Access Profile (0x1800)
        Handle range: 0x0006-0x0009
        UUID: Generic Attribute Profile (0x1801)
> HCI Event: Number of Completed Packets (0x13) plen 5                                                                                                                                               #22 [hci0] 2019-12-02 22:38:46.180259
        Num handles: 1
        Handle: 128
        Count: 1
> ACL Data RX: Handle 128 flags 0x02 dlen 46                                                                                                                                                         #23 [hci0] 2019-12-02 22:38:46.240191
      ATT: Read By Group Type Response (0x11) len 41
        Attribute data length: 20
        Attribute group list: 2 entries
        Handle range: 0x0023-0x002c
        UUID: Vendor specific (7905f431-b5ce-4e99-a40f-4b1e122d00d0)
        Handle range: 0x002d-0x0038
        UUID: Vendor specific (89d3502b-0f36-433a-8ef4-c502ad55f8dc)
< ACL Data TX: Handle 128 flags 0x00 dlen 11                                                                                                                                                         #24 [hci0] 2019-12-02 22:38:46.240291
      ATT: Read By Group Type Request (0x10) len 6
        Handle range: 0x0039-0xffff
        Attribute group type: Primary Service (0x2800)
> ACL Data RX: Handle 128 flags 0x02 dlen 11                                                                                                                                                         #25 [hci0] 2019-12-02 22:38:46.330154
      ATT: Read By Group Type Request (0x10) len 6
        Handle range: 0x000a-0xffff
        Attribute group type: Primary Service (0x2800)
< ACL Data TX: Handle 128 flags 0x00 dlen 26                                                                                                                                                         #26 [hci0] 2019-12-02 22:38:46.330254
      ATT: Read By Group Type Response (0x11) len 21
        Attribute data length: 20
        Attribute group list: 1 entry
        Handle range: 0x000a-0x0016
        UUID: Vendor specific (7ba40001-9b4c-453b-aadc-55c5aa031fad)
> HCI Event: Number of Completed Packets (0x13) plen 5                                                                                                                                               #27 [hci0] 2019-12-02 22:38:46.330408
        Num handles: 1
        Handle: 128
        Count: 1
> HCI Event: Number of Completed Packets (0x13) plen 5                                                                                                                                               #28 [hci0] 2019-12-02 22:38:46.390714
        Num handles: 1
        Handle: 128
        Count: 1
> ACL Data RX: Handle 128 flags 0x02 dlen 9                                                                                                                                                          #29 [hci0] 2019-12-02 22:38:46.481179
      ATT: Error Response (0x01) len 4
        Read By Group Type Request (0x10)
        Handle: 0x0039
        Error: Attribute Not Found (0x0a)
< ACL Data TX: Handle 128 flags 0x00 dlen 11                                                                                                                                                         #30 [hci0] 2019-12-02 22:38:46.481328
      ATT: Read By Group Type Request (0x10) len 6
        Handle range: 0x0001-0xffff
        Attribute group type: Secondary Service (0x2801)
> HCI Event: Number of Completed Packets (0x13) plen 5                                                                                                                                               #31 [hci0] 2019-12-02 22:38:46.481433
        Num handles: 1
        Handle: 128
        Count: 1
> ACL Data RX: Handle 128 flags 0x02 dlen 11                                                                                                                                                         #32 [hci0] 2019-12-02 22:38:46.570395
      ATT: Read By Group Type Request (0x10) len 6
        Handle range: 0x0017-0xffff
        Attribute group type: Primary Service (0x2800)
< ACL Data TX: Handle 128 flags 0x00 dlen 9                                                                                                                                                          #33 [hci0] 2019-12-02 22:38:46.570503
      ATT: Error Response (0x01) len 4
        Read By Group Type Request (0x10)
        Handle: 0x0017
        Error: Attribute Not Found (0x0a)
> ACL Data RX: Handle 128 flags 0x02 dlen 9                                                                                                                                                          #34 [hci0] 2019-12-02 22:38:46.600423
      ATT: Error Response (0x01) len 4
        Read By Group Type Request (0x10)
        Handle: 0x0038
        Error: Attribute Not Found (0x0a)
< ACL Data TX: Handle 128 flags 0x00 dlen 11                                                                                                                                                         #35 [hci0] 2019-12-02 22:38:46.600519
      ATT: Read By Type Request (0x08) len 6
        Handle range: 0x0001-0x0038
        Attribute type: Include (0x2802)
> HCI Event: Number of Completed Packets (0x13) plen 5                                                                                                                                               #36 [hci0] 2019-12-02 22:38:46.600924
        Num handles: 1
        Handle: 128
        Count: 1
> ACL Data RX: Handle 128 flags 0x02 dlen 11                                                                                                                                                         #37 [hci0] 2019-12-02 22:38:46.630467
      ATT: Read By Type Request (0x08) len 6
        Handle range: 0x0006-0x0009
        Attribute type: Characteristic (0x2803)
< ACL Data TX: Handle 128 flags 0x00 dlen 13                                                                                                                                                         #38 [hci0] 2019-12-02 22:38:46.630651
      ATT: Read By Type Response (0x09) len 8
        Attribute data length: 7
        Attribute data list: 1 entry
        Handle: 0x0007
        Value: 200800052a
> HCI Event: Number of Completed Packets (0x13) plen 5                                                                                                                                               #39 [hci0] 2019-12-02 22:38:46.630837
        Num handles: 1
        Handle: 128
        Count: 1
> ACL Data RX: Handle 128 flags 0x02 dlen 9                                                                                                                                                          #40 [hci0] 2019-12-02 22:38:46.720548
      ATT: Error Response (0x01) len 4
        Read By Type Request (0x08)
        Handle: 0x0038
        Error: Attribute Not Found (0x0a)
< ACL Data TX: Handle 128 flags 0x00 dlen 11                                                                                                                                                         #41 [hci0] 2019-12-02 22:38:46.720688
      ATT: Read By Type Request (0x08) len 6
        Handle range: 0x0001-0x0038
        Attribute type: Characteristic (0x2803)
> HCI Event: Number of Completed Packets (0x13) plen 5                                                                                                                                               #42 [hci0] 2019-12-02 22:38:46.721045
        Num handles: 1
        Handle: 128
        Count: 1
> ACL Data RX: Handle 128 flags 0x02 dlen 9                                                                                                                                                          #43 [hci0] 2019-12-02 22:38:46.810635
      ATT: Find Information Request (0x04) len 4
        Handle range: 0x0009-0x0009
< ACL Data TX: Handle 128 flags 0x00 dlen 10                                                                                                                                                         #44 [hci0] 2019-12-02 22:38:46.810729
      ATT: Find Information Response (0x05) len 5
        Format: UUID-16 (0x01)
        Handle: 0x0009
        UUID: Client Characteristic Configuration (0x2902)
> HCI Event: Number of Completed Packets (0x13) plen 5                                                                                                                                               #45 [hci0] 2019-12-02 22:38:46.811135
        Num handles: 1
        Handle: 128
        Count: 1
> HCI Event: Number of Completed Packets (0x13) plen 5                                                                                                                                               #46 [hci0] 2019-12-02 22:38:46.990815
        Num handles: 1
        Handle: 128
        Count: 1
> ACL Data RX: Handle 128 flags 0x02 dlen 27                                                                                                                                                         #47 [hci0] 2019-12-02 22:38:47.231200
      ATT: Read By Type Response (0x09) len 22
        Attribute data length: 7
        Attribute data list: 3 entries
        Handle: 0x0002
        Value: 020300002a
        Handle: 0x0004
        Value: 020500012a
        Handle: 0x0007
        Value: 200800052a
< ACL Data TX: Handle 128 flags 0x00 dlen 11                                                                                                                                                         #48 [hci0] 2019-12-02 22:38:47.231348
      ATT: Read By Type Request (0x08) len 6
        Handle range: 0x0008-0x0038
        Attribute type: Characteristic (0x2803)
> HCI Event: Number of Completed Packets (0x13) plen 5                                                                                                                                               #49 [hci0] 2019-12-02 22:38:47.231436
        Num handles: 1
        Handle: 128
        Count: 1
> ACL Data RX: Handle 128 flags 0x02 dlen 9                                                                                                                                                          #50 [hci0] 2019-12-02 22:38:47.291625
      ATT: Write Request (0x12) len 4
        Handle: 0x0009
          Data: 0200
< ACL Data TX: Handle 128 flags 0x00 dlen 5                                                                                                                                                          #51 [hci0] 2019-12-02 22:38:47.291847
      ATT: Write Response (0x13) len 0
> HCI Event: Number of Completed Packets (0x13) plen 5                                                                                                                                               #52 [hci0] 2019-12-02 22:38:47.501329
        Num handles: 1
        Handle: 128
        Count: 1
> ACL Data RX: Handle 128 flags 0x02 dlen 48                                                                                                                                                         #53 [hci0] 2019-12-02 22:38:47.502326
      ATT: Read By Type Response (0x09) len 43
        Attribute data length: 21
        Attribute data list: 2 entries
        Handle: 0x000b
        Value: 980c004900d927ee54ed84914c379a6c556786
        Handle: 0x0010
        Value: 981100cce349c57ba77a91cd43995bb1ad0baf
< ACL Data TX: Handle 128 flags 0x00 dlen 11                                                                                                                                                         #54 [hci0] 2019-12-02 22:38:47.502432
      ATT: Read By Type Request (0x08) len 6
        Handle range: 0x0011-0x0038
        Attribute type: Characteristic (0x2803)
> HCI Event: Number of Completed Packets (0x13) plen 5                                                                                                                                               #55 [hci0] 2019-12-02 22:38:47.502579
        Num handles: 1
        Handle: 128
        Count: 1
> ACL Data RX: Handle 128 flags 0x02 dlen 11                                                                                                                                                         #56 [hci0] 2019-12-02 22:38:47.651491
      ATT: Read By Type Request (0x08) len 6
        Handle range: 0x0001-0x0005
        Attribute type: Device Name (0x2a00)
< ACL Data TX: Handle 128 flags 0x00 dlen 24                                                                                                                                                         #57 [hci0] 2019-12-02 22:38:47.651694
      ATT: Read By Type Response (0x09) len 19
        Attribute data length: 18
        Attribute data list: 1 entry
        Handle: 0x0003
        Value: 4c39313774375a455251615676356761
> HCI Event: Number of Completed Packets (0x13) plen 5                                                                                                                                               #58 [hci0] 2019-12-02 22:38:47.832287
        Num handles: 1
        Handle: 128
        Count: 1
> ACL Data RX: Handle 128 flags 0x02 dlen 41                                                                                                                                                         #59 [hci0] 2019-12-02 22:38:47.861936
      ATT: Read By Type Response (0x09) len 36
        Attribute data length: 7
        Attribute data list: 5 entries
        Handle: 0x0015
        Value: 121600192a
        Handle: 0x0019
        Value: 121a002b2a
        Handle: 0x001c
        Value: 021d000f2a
        Handle: 0x001f
        Value: 022000292a
        Handle: 0x0021
        Value: 022200242a
< ACL Data TX: Handle 128 flags 0x00 dlen 11                                                                                                                                                         #60 [hci0] 2019-12-02 22:38:47.862067
      ATT: Read By Type Request (0x08) len 6
        Handle range: 0x0022-0x0038
        Attribute type: Characteristic (0x2803)
> HCI Event: Number of Completed Packets (0x13) plen 5                                                                                                                                               #61 [hci0] 2019-12-02 22:38:47.862199
        Num handles: 1
        Handle: 128
        Count: 1
> ACL Data RX: Handle 128 flags 0x02 dlen 11                                                                                                                                                         #62 [hci0] 2019-12-02 22:38:47.922246
      ATT: Read By Type Request (0x08) len 6
        Handle range: 0x000a-0x0016
        Attribute type: Characteristic (0x2803)
< ACL Data TX: Handle 128 flags 0x00 dlen 111                                                                                                                                                        #63 [hci0] 2019-12-02 22:38:47.922342
      ATT: Read By Type Response (0x09) len 106
        Attribute data length: 21
        Attribute data list: 5 entries
        Handle: 0x000b
        Value: 120c00ad1f03aac555dcaa3b454c9b0600a47b
        Handle: 0x000e
        Value: 0a0f00ad1f03aac555dcaa3b454c9b0500a47b
        Handle: 0x0010
        Value: 081100ad1f03aac555dcaa3b454c9b0400a47b
        Handle: 0x0012
        Value: 121300ad1f03aac555dcaa3b454c9b0200a47b
        Handle: 0x0015
        Value: 081600ad1f03aac555dcaa3b454c9b0300a47b
> HCI Event: Number of Completed Packets (0x13) plen 5                                                                                                                                               #64 [hci0] 2019-12-02 22:38:47.952275
        Num handles: 1
        Handle: 128
        Count: 1
> ACL Data RX: Handle 128 flags 0x02 dlen 132                                                                                                                                                        #65 [hci0] 2019-12-02 22:38:48.223552
      ATT: Read By Type Response (0x09) len 127
        Attribute data length: 21
        Attribute data list: 6 entries
        Handle: 0x0024
        Value: 882500d9d9aafdbd9b2198a849e145f3d8d169
        Handle: 0x0027
        Value: 102800bd1da299e625588cd94201630d12bf9f
        Handle: 0x002a
        Value: 102b00fb7b7cce6ab344beb54bd624e9c6ea22
        Handle: 0x002e
        Value: 982f00c251caf7560edfb88a4ab157d8813c9b
        Handle: 0x0032
        Value: 98330002c196ba92bb0c9a1f418d80ceab7c2f
        Handle: 0x0036
        Value: 8a3700d7d5bb70a8a3aba6d846ab238cf3b2c6
< ACL Data TX: Handle 128 flags 0x00 dlen 11                                                                                                                                                         #66 [hci0] 2019-12-02 22:38:48.223671
      ATT: Read By Type Request (0x08) len 6
        Handle range: 0x0037-0x0038
        Attribute type: Characteristic (0x2803)
> HCI Event: Number of Completed Packets (0x13) plen 5                                                                                                                                               #67 [hci0] 2019-12-02 22:38:48.223802
        Num handles: 1
        Handle: 128
        Count: 1
> ACL Data RX: Handle 128 flags 0x02 dlen 9                                                                                                                                                          #68 [hci0] 2019-12-02 22:38:48.342168
      ATT: Find Information Request (0x04) len 4
        Handle range: 0x000d-0x000d
< ACL Data TX: Handle 128 flags 0x00 dlen 10                                                                                                                                                         #69 [hci0] 2019-12-02 22:38:48.342287
      ATT: Find Information Response (0x05) len 5
        Format: UUID-16 (0x01)
        Handle: 0x000d
        UUID: Client Characteristic Configuration (0x2902)
> HCI Event: Number of Completed Packets (0x13) plen 5                                                                                                                                               #70 [hci0] 2019-12-02 22:38:48.402726
        Num handles: 1
        Handle: 128
        Count: 1
> ACL Data RX: Handle 128 flags 0x02 dlen 9                                                                                                                                                          #71 [hci0] 2019-12-02 22:38:48.463160
      ATT: Error Response (0x01) len 4
        Read By Type Request (0x08)
        Handle: 0x0038
        Error: Attribute Not Found (0x0a)
< ACL Data TX: Handle 128 flags 0x00 dlen 9                                                                                                                                                          #72 [hci0] 2019-12-02 22:38:48.463329
      ATT: Find Information Request (0x04) len 4
        Handle range: 0x0009-0x0009
> HCI Event: Number of Completed Packets (0x13) plen 5                                                                                                                                               #73 [hci0] 2019-12-02 22:38:48.463414
        Num handles: 1
        Handle: 128
        Count: 1
> ACL Data RX: Handle 128 flags 0x02 dlen 9                                                                                                                                                          #74 [hci0] 2019-12-02 22:38:48.552376
      ATT: Find Information Request (0x04) len 4
        Handle range: 0x0014-0x0014
< ACL Data TX: Handle 128 flags 0x00 dlen 10                                                                                                                                                         #75 [hci0] 2019-12-02 22:38:48.552458
      ATT: Find Information Response (0x05) len 5
        Format: UUID-16 (0x01)
        Handle: 0x0014
        UUID: Client Characteristic Configuration (0x2902)
> HCI Event: Number of Completed Packets (0x13) plen 5                                                                                                                                               #76 [hci0] 2019-12-02 22:38:48.612561
        Num handles: 1
        Handle: 128
        Count: 1
> HCI Event: Number of Completed Packets (0x13) plen 5                                                                                                                                               #77 [hci0] 2019-12-02 22:38:48.613310
        Num handles: 1
        Handle: 128
        Count: 1
> ACL Data RX: Handle 128 flags 0x02 dlen 10                                                                                                                                                         #78 [hci0] 2019-12-02 22:38:48.613319
      ATT: Find Information Response (0x05) len 5
        Format: UUID-16 (0x01)
        Handle: 0x0009
        UUID: Client Characteristic Configuration (0x2902)
< ACL Data TX: Handle 128 flags 0x00 dlen 9                                                                                                                                                          #79 [hci0] 2019-12-02 22:38:48.613405
      ATT: Find Information Request (0x04) len 4
        Handle range: 0x000d-0x000e
> ACL Data RX: Handle 128 flags 0x02 dlen 14                                                                                                                                                         #80 [hci0] 2019-12-02 22:38:48.702666
      ATT: Find Information Response (0x05) len 9
        Format: UUID-16 (0x01)
        Handle: 0x000d
        UUID: Characteristic Extended Properties (0x2900)
        Handle: 0x000e
        UUID: Client Characteristic Configuration (0x2902)
< ACL Data TX: Handle 128 flags 0x00 dlen 7                                                                                                                                                          #81 [hci0] 2019-12-02 22:38:48.702864
      ATT: Read Request (0x0a) len 2
        Handle: 0x000d
> HCI Event: Number of Completed Packets (0x13) plen 5                                                                                                                                               #82 [hci0] 2019-12-02 22:38:48.703034
        Num handles: 1
        Handle: 128
        Count: 1
> ACL Data RX: Handle 128 flags 0x02 dlen 7                                                                                                                                                          #83 [hci0] 2019-12-02 22:38:48.792753
      ATT: Read Response (0x0b) len 2
        Value: 0100
< ACL Data TX: Handle 128 flags 0x00 dlen 9                                                                                                                                                          #84 [hci0] 2019-12-02 22:38:48.792946
      ATT: Find Information Request (0x04) len 4
        Handle range: 0x0012-0x0013
> HCI Event: Number of Completed Packets (0x13) plen 5                                                                                                                                               #85 [hci0] 2019-12-02 22:38:48.793001
        Num handles: 1
        Handle: 128
        Count: 1
> ACL Data RX: Handle 128 flags 0x02 dlen 14                                                                                                                                                         #86 [hci0] 2019-12-02 22:38:48.852803
      ATT: Find Information Response (0x05) len 9
        Format: UUID-16 (0x01)
        Handle: 0x0012
        UUID: Characteristic Extended Properties (0x2900)
        Handle: 0x0013
        UUID: Client Characteristic Configuration (0x2902)
< ACL Data TX: Handle 128 flags 0x00 dlen 7                                                                                                                                                          #87 [hci0] 2019-12-02 22:38:48.852912
      ATT: Read Request (0x0a) len 2
        Handle: 0x0012
> HCI Event: Number of Completed Packets (0x13) plen 5                                                                                                                                               #88 [hci0] 2019-12-02 22:38:48.853055
        Num handles: 1
        Handle: 128
        Count: 1
> ACL Data RX: Handle 128 flags 0x02 dlen 7                                                                                                                                                          #89 [hci0] 2019-12-02 22:38:48.972921
      ATT: Read Response (0x0b) len 2
        Value: 0100
< ACL Data TX: Handle 128 flags 0x00 dlen 9                                                                                                                                                          #90 [hci0] 2019-12-02 22:38:48.973007
      ATT: Find Information Request (0x04) len 4
        Handle range: 0x0017-0x0017
> HCI Event: Number of Completed Packets (0x13) plen 5                                                                                                                                               #91 [hci0] 2019-12-02 22:38:48.973174
        Num handles: 1
        Handle: 128
        Count: 1
> ACL Data RX: Handle 128 flags 0x02 dlen 10                                                                                                                                                         #92 [hci0] 2019-12-02 22:38:49.093043
      ATT: Find Information Response (0x05) len 5
        Format: UUID-16 (0x01)
        Handle: 0x0017
        UUID: Client Characteristic Configuration (0x2902)
< ACL Data TX: Handle 128 flags 0x00 dlen 9                                                                                                                                                          #93 [hci0] 2019-12-02 22:38:49.093155
      ATT: Find Information Request (0x04) len 4
        Handle range: 0x001b-0x001b
> HCI Event: Number of Completed Packets (0x13) plen 5                                                                                                                                               #94 [hci0] 2019-12-02 22:38:49.093296
        Num handles: 1
        Handle: 128
        Count: 1
> ACL Data RX: Handle 128 flags 0x02 dlen 10                                                                                                                                                         #95 [hci0] 2019-12-02 22:38:49.243197
      ATT: Find Information Response (0x05) len 5
        Format: UUID-16 (0x01)
        Handle: 0x001b
        UUID: Client Characteristic Configuration (0x2902)
< ACL Data TX: Handle 128 flags 0x00 dlen 9                                                                                                                                                          #96 [hci0] 2019-12-02 22:38:49.243370
      ATT: Find Information Request (0x04) len 4
        Handle range: 0x0026-0x0026
> HCI Event: Number of Completed Packets (0x13) plen 5                                                                                                                                               #97 [hci0] 2019-12-02 22:38:49.243448
        Num handles: 1
        Handle: 128
        Count: 1
> ACL Data RX: Handle 128 flags 0x02 dlen 10                                                                                                                                                         #98 [hci0] 2019-12-02 22:38:49.303251
      ATT: Find Information Response (0x05) len 5
        Format: UUID-16 (0x01)
        Handle: 0x0026
        UUID: Characteristic Extended Properties (0x2900)
< ACL Data TX: Handle 128 flags 0x00 dlen 7                                                                                                                                                          #99 [hci0] 2019-12-02 22:38:49.303343
      ATT: Read Request (0x0a) len 2
        Handle: 0x0026
> HCI Event: Number of Completed Packets (0x13) plen 5                                                                                                                                              #100 [hci0] 2019-12-02 22:38:49.303504
        Num handles: 1
        Handle: 128
        Count: 1
> ACL Data RX: Handle 128 flags 0x02 dlen 7                                                                                                                                                         #101 [hci0] 2019-12-02 22:38:49.453401
      ATT: Read Response (0x0b) len 2
        Value: 0100
< ACL Data TX: Handle 128 flags 0x00 dlen 9                                                                                                                                                         #102 [hci0] 2019-12-02 22:38:49.453477
      ATT: Find Information Request (0x04) len 4
        Handle range: 0x0029-0x0029
> HCI Event: Number of Completed Packets (0x13) plen 5                                                                                                                                              #103 [hci0] 2019-12-02 22:38:49.453528
        Num handles: 1
        Handle: 128
        Count: 1
> ACL Data RX: Handle 128 flags 0x02 dlen 10                                                                                                                                                        #104 [hci0] 2019-12-02 22:38:49.513593
      ATT: Find Information Response (0x05) len 5
        Format: UUID-16 (0x01)
        Handle: 0x0029
        UUID: Client Characteristic Configuration (0x2902)
< ACL Data TX: Handle 128 flags 0x00 dlen 9                                                                                                                                                         #105 [hci0] 2019-12-02 22:38:49.513720
      ATT: Find Information Request (0x04) len 4
        Handle range: 0x002c-0x002c
> HCI Event: Number of Completed Packets (0x13) plen 5                                                                                                                                              #106 [hci0] 2019-12-02 22:38:49.513842
        Num handles: 1
        Handle: 128
        Count: 1
> HCI Event: Number of Completed Packets (0x13) plen 5                                                                                                                                              #107 [hci0] 2019-12-02 22:38:49.573897
        Num handles: 1
        Handle: 128
        Count: 1
> ACL Data RX: Handle 128 flags 0x02 dlen 10                                                                                                                                                        #108 [hci0] 2019-12-02 22:38:49.693529
      ATT: Find Information Response (0x05) len 5
        Format: UUID-16 (0x01)
        Handle: 0x002c
        UUID: Client Characteristic Configuration (0x2902)
< ACL Data TX: Handle 128 flags 0x00 dlen 9                                                                                                                                                         #109 [hci0] 2019-12-02 22:38:49.693709
      ATT: Find Information Request (0x04) len 4
        Handle range: 0x0030-0x0031
> ACL Data RX: Handle 128 flags 0x02 dlen 14                                                                                                                                                        #110 [hci0] 2019-12-02 22:38:49.753835
      ATT: Find Information Response (0x05) len 9
        Format: UUID-16 (0x01)
        Handle: 0x0030
        UUID: Characteristic Extended Properties (0x2900)
        Handle: 0x0031
        UUID: Client Characteristic Configuration (0x2902)
< ACL Data TX: Handle 128 flags 0x00 dlen 7                                                                                                                                                         #111 [hci0] 2019-12-02 22:38:49.754010
      ATT: Read Request (0x0a) len 2
        Handle: 0x0030
> HCI Event: Number of Completed Packets (0x13) plen 5                                                                                                                                              #112 [hci0] 2019-12-02 22:38:49.754086
        Num handles: 1
        Handle: 128
        Count: 1
> ACL Data RX: Handle 128 flags 0x02 dlen 7                                                                                                                                                         #113 [hci0] 2019-12-02 22:38:49.963915
      ATT: Read Response (0x0b) len 2
        Value: 0100
< ACL Data TX: Handle 128 flags 0x00 dlen 9                                                                                                                                                         #114 [hci0] 2019-12-02 22:38:49.964037
      ATT: Find Information Request (0x04) len 4
        Handle range: 0x0034-0x0035
> HCI Event: Number of Completed Packets (0x13) plen 5                                                                                                                                              #115 [hci0] 2019-12-02 22:38:49.964170
        Num handles: 1
        Handle: 128
        Count: 1
> ACL Data RX: Handle 128 flags 0x02 dlen 14                                                                                                                                                        #116 [hci0] 2019-12-02 22:38:50.114190
      ATT: Find Information Response (0x05) len 9
        Format: UUID-16 (0x01)
        Handle: 0x0034
        UUID: Characteristic Extended Properties (0x2900)
        Handle: 0x0035
        UUID: Client Characteristic Configuration (0x2902)
< ACL Data TX: Handle 128 flags 0x00 dlen 7                                                                                                                                                         #117 [hci0] 2019-12-02 22:38:50.114405
      ATT: Read Request (0x0a) len 2
        Handle: 0x0034
> HCI Event: Number of Completed Packets (0x13) plen 5                                                                                                                                              #118 [hci0] 2019-12-02 22:38:50.114442
        Num handles: 1
        Handle: 128
        Count: 1
> ACL Data RX: Handle 128 flags 0x02 dlen 7                                                                                                                                                         #119 [hci0] 2019-12-02 22:38:50.204166
      ATT: Read Response (0x0b) len 2
        Value: 0100
> HCI Event: Number of Completed Packets (0x13) plen 5                                                                                                                                              #120 [hci0] 2019-12-02 22:38:50.204411
        Num handles: 1
        Handle: 128
        Count: 1
< ACL Data TX: Handle 128 flags 0x00 dlen 9                                                                                                                                                         #121 [hci0] 2019-12-02 22:38:50.204570
      ATT: Find Information Request (0x04) len 4
        Handle range: 0x0038-0x0038
> ACL Data RX: Handle 128 flags 0x02 dlen 10                                                                                                                                                        #122 [hci0] 2019-12-02 22:38:50.354433
      ATT: Find Information Response (0x05) len 5
        Format: UUID-16 (0x01)
        Handle: 0x0038
        UUID: Characteristic Extended Properties (0x2900)
> HCI Event: Number of Completed Packets (0x13) plen 5                                                                                                                                              #123 [hci0] 2019-12-02 22:38:50.354684
        Num handles: 1
        Handle: 128
        Count: 1
< ACL Data TX: Handle 128 flags 0x00 dlen 7                                                                                                                                                         #124 [hci0] 2019-12-02 22:38:50.354822
      ATT: Read Request (0x0a) len 2
        Handle: 0x0038
> ACL Data RX: Handle 128 flags 0x02 dlen 7                                                                                                                                                         #125 [hci0] 2019-12-02 22:38:50.594553
      ATT: Read Response (0x0b) len 2
        Value: 0100
> HCI Event: Number of Completed Packets (0x13) plen 5                                                                                                                                              #126 [hci0] 2019-12-02 22:38:50.594930
        Num handles: 1
        Handle: 128
        Count: 1
= bluetoothd: Can't store services for private addressed device /org/bluez/hci0/dev_77_16_CC_2C_E3_E8                                                                                                           2019-12-02 22:38:50.599924
= bluetoothd: Can't store GATT db for private addressed device /org/bluez/hci0/dev_77_16_CC_2C_E3_E8                                                                                                            2019-12-02 22:38:50.601574
< ACL Data TX: Handle 128 flags 0x00 dlen 9                                                                                                                                                         #127 [hci0] 2019-12-02 22:38:50.601730
      ATT: Write Request (0x12) len 4
        Handle: 0x0009
          Data: 0200
> ACL Data RX: Handle 128 flags 0x02 dlen 5                                                                                                                                                         #128 [hci0] 2019-12-02 22:38:50.924882
      ATT: Write Response (0x13) len 0
< ACL Data TX: Handle 128 flags 0x00 dlen 7                                                                                                                                                         #129 [hci0] 2019-12-02 22:38:50.925119
      ATT: Read Request (0x0a) len 2
        Handle: 0x0003
> HCI Event: Number of Completed Packets (0x13) plen 5                                                                                                                                              #130 [hci0] 2019-12-02 22:38:50.925260
        Num handles: 1
        Handle: 128
        Count: 1
> ACL Data RX: Handle 128 flags 0x02 dlen 11                                                                                                                                                        #131 [hci0] 2019-12-02 22:38:51.315394
      ATT: Read Response (0x0b) len 6
        Value: 6950686f6e65
< ACL Data TX: Handle 128 flags 0x00 dlen 7                                                                                                                                                         #132 [hci0] 2019-12-02 22:38:51.315543
      ATT: Read Request (0x0a) len 2
        Handle: 0x0005
> HCI Event: Number of Completed Packets (0x13) plen 5                                                                                                                                              #133 [hci0] 2019-12-02 22:38:51.315899
        Num handles: 1
        Handle: 128
        Count: 1
> ACL Data RX: Handle 128 flags 0x02 dlen 7                                                                                                                                                         #134 [hci0] 2019-12-02 22:38:51.465539
      ATT: Read Response (0x0b) len 2
        Value: 4000
> HCI Event: Number of Completed Packets (0x13) plen 5                                                                                                                                              #135 [hci0] 2019-12-02 22:38:51.466044
        Num handles: 1
        Handle: 128
        Count: 1