~ # btmon -STA                                                                                                                                                                                                   root@CNJ1KSN01C
Bluetooth monitor ver 5.47
= Note: Linux version 4.14.76-armada-18.12.3-ga4fd10602e22 (armv7l)                                                                                                                                   2019-12-02 22:29:43.439498
= Note: Bluetooth subsystem version 2.22                                                                                                                                                              2019-12-02 22:29:43.439502
= New Index: 20:4C:03:81:02:7D (Primary,USB,hci0)                                                                                                                                              [hci0] 2019-12-02 22:29:43.439504
= Open Index: 20:4C:03:81:02:7D                                                                                                                                                                [hci0] 2019-12-02 22:29:43.439505
= Index Info: 20:4C:03:81:02:7D (Marvell Technology Group Ltd.)                                                                                                                                [hci0] 2019-12-02 22:29:43.439506
@ MGMT Open: bluetoothd (privileged) version 1.14                                                                                                                                            {0x0002} 2019-12-02 22:29:43.439507
@ MGMT Open: bluetoothd (privileged) version 1.14                                                                                                                                            {0x0001} 2019-12-02 22:29:43.439508
@ MGMT Open: btmon (privileged) version 1.14                                                                                                                                                 {0x0003} 2019-12-02 22:29:43.439534
> HCI Event: LE Meta Event (0x3e) plen 19                                                                                                                                                   #1 [hci0] 2019-12-02 22:31:45.984692
      LE Connection Complete (0x01)
        Status: Success (0x00)
        Handle: 128
        Role: Slave (0x01)
        Peer address type: Random (0x01)
        Peer address: 77:16:CC:2C:E3:E8 (Resolvable)
        Connection interval: 30.00 msec (0x0018)
        Connection latency: 0 (0x0000)
        Supervision timeout: 720 msec (0x0048)
        Master clock accuracy: 0x01
@ MGMT Event: Device Connected (0x000b) plen 13                                                                                                                                       {0x0003} [hci0] 2019-12-02 22:31:45.984728
        LE Address: 77:16:CC:2C:E3:E8 (Resolvable)
        Flags: 0x00000000
        Data length: 0
@ MGMT Event: Device Connected (0x000b) plen 13                                                                                                                                       {0x0002} [hci0] 2019-12-02 22:31:45.984728
        LE Address: 77:16:CC:2C:E3:E8 (Resolvable)
        Flags: 0x00000000
        Data length: 0
@ MGMT Event: Device Connected (0x000b) plen 13                                                                                                                                       {0x0001} [hci0] 2019-12-02 22:31:45.984728
        LE Address: 77:16:CC:2C:E3:E8 (Resolvable)
        Flags: 0x00000000
        Data length: 0
< HCI Command: LE Read Remote Used Features (0x08|0x0016) plen 2                                                                                                                            #2 [hci0] 2019-12-02 22:31:45.984837
        Handle: 128
> HCI Event: Command Status (0x0f) plen 4                                                                                                                                                   #3 [hci0] 2019-12-02 22:31:45.990075
      LE Read Remote Used Features (0x08|0x0016) ncmd 1
        Status: Success (0x00)
> HCI Event: LE Meta Event (0x3e) plen 11                                                                                                                                                   #4 [hci0] 2019-12-02 22:31:46.299889
      LE Data Length Change (0x07)
        Handle: 128
        Max TX octets: 251
        Max TX time: 2120
        Max RX octets: 251
        Max RX time: 2120
> HCI Event: LE Meta Event (0x3e) plen 12                                                                                                                                                   #5 [hci0] 2019-12-02 22:31:47.110818
      LE Read Remote Used Features (0x04)
        Status: Success (0x00)
        Handle: 128
        Features: 0xff 0x01 0x00 0x00 0x00 0x00 0x00 0x00
          LE Encryption
          Connection Parameter Request Procedure
          Extended Reject Indication
          Slave-initiated Features Exchange
          LE Ping
          LE Data Packet Length Extension
          LL Privacy
          Extended Scanner Filter Policies
          LE 2M PHY
> HCI Event: Disconnect Complete (0x05) plen 4                                                                                                                                              #6 [hci0] 2019-12-02 22:31:47.111065
        Status: Success (0x00)
        Handle: 128
        Reason: Connection Timeout (0x08)
@ MGMT Event: Device Disconnected (0x000c) plen 8                                                                                                                                     {0x0003} [hci0] 2019-12-02 22:31:47.111086
        LE Address: 77:16:CC:2C:E3:E8 (Resolvable)
        Reason: Connection timeout (0x01)
@ MGMT Event: Device Disconnected (0x000c) plen 8                                                                                                                                     {0x0002} [hci0] 2019-12-02 22:31:47.111086
        LE Address: 77:16:CC:2C:E3:E8 (Resolvable)
        Reason: Connection timeout (0x01)
@ MGMT Event: Device Disconnected (0x000c) plen 8                                                                                                                                     {0x0001} [hci0] 2019-12-02 22:31:47.111086
        LE Address: 77:16:CC:2C:E3:E8 (Resolvable)
        Reason: Connection timeout (0x01)
> HCI Event: Vendor (0xff) plen 67                                                                                                                                                          #7 [hci0] 2019-12-02 22:31:47.111440
        72 80 00 7d 17 00 00 07 18 00 00 9d 17 00 00 81  r..}............
        17 00 00 f5 17 00 00 00 00 00 00 00 00 00 00 00  ................
        00 00 00 00 00 00 00 00 00 00 00 00 00 00 00 00  ................
        00 00 00 00 00 00 00 00 00 00 00 00 00 00 00 01  ................
        00 00 00                                         ...             
< HCI Command: LE Set Advertising Parameters (0x08|0x0006) plen 15                                                                                                                          #8 [hci0] 2019-12-02 22:31:48.702209
        Min advertising interval: 1280.000 msec (0x0800)
        Max advertising interval: 1280.000 msec (0x0800)
        Type: Connectable undirected - ADV_IND (0x00)
        Own address type: Public (0x00)
        Direct address type: Public (0x00)
        Direct address: 00:00:00:00:00:00 (OUI 00-00-00)
        Channel map: 37, 38, 39 (0x07)
        Filter policy: Allow Scan Request from Any, Allow Connect Request from Any (0x00)
> HCI Event: Command Complete (0x0e) plen 4                                                                                                                                                 #9 [hci0] 2019-12-02 22:31:48.705155
      LE Set Advertising Parameters (0x08|0x0006) ncmd 1
        Status: Success (0x00)
< HCI Command: LE Set Advertise Enable (0x08|0x000a) plen 1                                                                                                                                #10 [hci0] 2019-12-02 22:31:48.705175
        Advertising: Enabled (0x01)
> HCI Event: Command Complete (0x0e) plen 4                                                                                                                                                #11 [hci0] 2019-12-02 22:31:48.709032
      LE Set Advertise Enable (0x08|0x000a) ncmd 1
        Status: Success (0x00)
> HCI Event: LE Meta Event (0x3e) plen 19                                                                                                                                                  #12 [hci0] 2019-12-02 22:31:50.002334
      LE Connection Complete (0x01)
        Status: Success (0x00)
        Handle: 128
        Role: Slave (0x01)
        Peer address type: Random (0x01)
        Peer address: 77:16:CC:2C:E3:E8 (Resolvable)
        Connection interval: 30.00 msec (0x0018)
        Connection latency: 0 (0x0000)
        Supervision timeout: 720 msec (0x0048)
        Master clock accuracy: 0x01
@ MGMT Event: Device Connected (0x000b) plen 13                                                                                                                                       {0x0003} [hci0] 2019-12-02 22:31:50.002370
        LE Address: 77:16:CC:2C:E3:E8 (Resolvable)
        Flags: 0x00000000
        Data length: 0
@ MGMT Event: Device Connected (0x000b) plen 13                                                                                                                                       {0x0002} [hci0] 2019-12-02 22:31:50.002370
        LE Address: 77:16:CC:2C:E3:E8 (Resolvable)
        Flags: 0x00000000
        Data length: 0
@ MGMT Event: Device Connected (0x000b) plen 13                                                                                                                                       {0x0001} [hci0] 2019-12-02 22:31:50.002370
        LE Address: 77:16:CC:2C:E3:E8 (Resolvable)
        Flags: 0x00000000
        Data length: 0
< HCI Command: LE Read Remote Used Features (0x08|0x0016) plen 2                                                                                                                           #13 [hci0] 2019-12-02 22:31:50.002498
        Handle: 128
> HCI Event: Command Status (0x0f) plen 4                                                                                                                                                  #14 [hci0] 2019-12-02 22:31:50.004707
      LE Read Remote Used Features (0x08|0x0016) ncmd 1
        Status: Success (0x00)
> HCI Event: LE Meta Event (0x3e) plen 11                                                                                                                                                  #15 [hci0] 2019-12-02 22:31:50.124579
      LE Data Length Change (0x07)
        Handle: 128
        Max TX octets: 251
        Max TX time: 2120
        Max RX octets: 251
        Max RX time: 2120
> HCI Event: LE Meta Event (0x3e) plen 12                                                                                                                                                  #16 [hci0] 2019-12-02 22:31:50.183759
      LE Read Remote Used Features (0x04)
        Status: Success (0x00)
        Handle: 128
        Features: 0x6f 0x01 0x00 0x00 0x00 0x00 0x00 0x00
          LE Encryption
          Connection Parameter Request Procedure
          Extended Reject Indication
          Slave-initiated Features Exchange
          LE Data Packet Length Extension
          LL Privacy
          LE 2M PHY
> HCI Event: LE Meta Event (0x3e) plen 6                                                                                                                                                   #17 [hci0] 2019-12-02 22:31:50.691016
      LE PHY Update Complete (0x0c)
        Status: Success (0x00)
        Handle: 128
        TX PHY: LE 2M (0x02)
        RX PHY: LE 2M (0x02)
> ACL Data RX: Handle 128 flags 0x02 dlen 7                                                                                                                                                #18 [hci0] 2019-12-02 22:31:50.723923
      ATT: Exchange MTU Request (0x02) len 2
        Client RX MTU: 527
< HCI Command: Disconnect (0x01|0x0006) plen 3                                                                                                                                             #19 [hci0] 2019-12-02 22:31:54.232206
        Handle: 128
        Reason: Remote User Terminated Connection (0x13)
> HCI Event: Command Status (0x0f) plen 4                                                                                                                                                  #20 [hci0] 2019-12-02 22:31:54.233808
      Disconnect (0x01|0x0006) ncmd 1
        Status: Success (0x00)
> HCI Event: Disconnect Complete (0x05) plen 4                                                                                                                                             #21 [hci0] 2019-12-02 22:31:54.358682
        Status: Success (0x00)
        Handle: 128
        Reason: Connection Terminated By Local Host (0x16)
@ MGMT Event: Device Disconnected (0x000c) plen 8                                                                                                                                     {0x0003} [hci0] 2019-12-02 22:31:54.358698
        LE Address: 77:16:CC:2C:E3:E8 (Resolvable)
        Reason: Connection terminated by local host (0x02)
@ MGMT Event: Device Disconnected (0x000c) plen 8                                                                                                                                     {0x0002} [hci0] 2019-12-02 22:31:54.358698
        LE Address: 77:16:CC:2C:E3:E8 (Resolvable)
        Reason: Connection terminated by local host (0x02)
@ MGMT Event: Device Disconnected (0x000c) plen 8                                                                                                                                     {0x0001} [hci0] 2019-12-02 22:31:54.358698
        LE Address: 77:16:CC:2C:E3:E8 (Resolvable)
        Reason: Connection terminated by local host (0x02)
< HCI Command: LE Set Advertising Parameters (0x08|0x0006) plen 15                                                                                                                         #22 [hci0] 2019-12-02 22:31:54.942232
        Min advertising interval: 1280.000 msec (0x0800)
        Max advertising interval: 1280.000 msec (0x0800)
        Type: Connectable undirected - ADV_IND (0x00)
        Own address type: Public (0x00)
        Direct address type: Public (0x00)
        Direct address: 00:00:00:00:00:00 (OUI 00-00-00)
        Channel map: 37, 38, 39 (0x07)
        Filter policy: Allow Scan Request from Any, Allow Connect Request from Any (0x00)
> HCI Event: Command Complete (0x0e) plen 4                                                                                                                                                #23 [hci0] 2019-12-02 22:31:54.946145
      LE Set Advertising Parameters (0x08|0x0006) ncmd 1
        Status: Success (0x00)
< HCI Command: LE Set Advertise Enable (0x08|0x000a) plen 1                                                                                                                                #24 [hci0] 2019-12-02 22:31:54.946171
        Advertising: Enabled (0x01)
> HCI Event: Command Complete (0x0e) plen 4                                                                                                                                                #25 [hci0] 2019-12-02 22:31:54.951273
      LE Set Advertise Enable (0x08|0x000a) ncmd 1
        Status: Success (0x00)
